{
  "schema_id": "OPM-DEV-CANVAS-06-INTAKE-REPORT-001",
  "schema_version": "0.1",
  "report_id": "dev-canvas-06.intake.dev-canvas-05.profile.iso19450.2024.draft.0.2.0.1847172f5090.aab281cf686d",
  "generated_at": "2026-08-03T10:42:31.921Z",
  "runner_identity": {
    "runner_version": "0.1.0",
    "source_commit": "1847172f509005e8d50b525e274d41b9d73cf46c",
    "node_version": "v22.22.0",
    "os": "darwin-arm64",
    "command": "npm run release:canvas06:intake -- --handoff-root <handoff-bundle-root> --handoff <relative-handoff-path> --handoff-sha256 <sha256> --out <report-path>",
    "runner_source_sha256": "7c836c56ee1111ed5b120ae094af9cb86d76c3d3c3810b3f60783712993c976c"
  },
  "handoff_ref": {
    "kind": "HANDOFF",
    "path": "dev-canvas-05-handoff.json",
    "byte_length": 37088,
    "sha256": "aab281cf686d2b3c0e4ef1e9f62860d9318e3bed11c805e1dd53a40cd6f8e5a4"
  },
  "intake_status": "READY_FOR_RELEASE_VALIDATION",
  "checks": [
    {
      "check_id": "INTAKE-06-001.HANDOFF_BYTES",
      "status": "MATCHED",
      "evidence_refs": [
        {
          "kind": "HANDOFF",
          "path": "dev-canvas-05-handoff.json",
          "byte_length": 37088,
          "sha256": "aab281cf686d2b3c0e4ef1e9f62860d9318e3bed11c805e1dd53a40cd6f8e5a4"
        }
      ],
      "observed_summary": "sha256=aab281cf686d2b3c0e4ef1e9f62860d9318e3bed11c805e1dd53a40cd6f8e5a4",
      "blocker_codes": []
    },
    {
      "check_id": "INTAKE-06-002.HANDOFF_SCHEMA_STATUS",
      "status": "MATCHED",
      "evidence_refs": [
        {
          "kind": "HANDOFF",
          "path": "dev-canvas-05-handoff.json",
          "byte_length": 37088,
          "sha256": "aab281cf686d2b3c0e4ef1e9f62860d9318e3bed11c805e1dd53a40cd6f8e5a4"
        }
      ],
      "observed_summary": "schema=valid, status=READY_FOR_DEV_CANVAS_06",
      "blocker_codes": []
    },
    {
      "check_id": "INTAKE-06-003.SOURCE_BUILD_ARTIFACTS",
      "status": "MATCHED",
      "evidence_refs": [
        {
          "kind": "LOCAL_RUNTIME_JAR",
          "path": "releases/clean-1847172f5090/local-runtime-0.1.0-SNAPSHOT.jar",
          "byte_length": 39308369,
          "sha256": "0cfe0f14f2190e64e4cbc39b8a8bfbb8c9a5b733607cb24c4801c872f87b3f49"
        },
        {
          "kind": "EVIDENCE_BUNDLE",
          "path": "releases/clean-1847172f5090/dev-canvas-05-evidence-bundle.jar",
          "byte_length": 953610,
          "sha256": "f336780b3f3641accbdd7b4fa5432f3041d5701dcba0e474edfbef63543f7360"
        }
      ],
      "observed_summary": "artifacts=2, dirty_before_build=false",
      "blocker_codes": []
    },
    {
      "check_id": "INTAKE-06-004.REVISION_BINDINGS",
      "status": "MATCHED",
      "evidence_refs": [
        {
          "kind": "SCHEMA",
          "path": "reports/revision-v01.schema.json",
          "byte_length": 17828,
          "sha256": "437e63bfae925f44e2a0bbed3b52c7f45957ff91fb6d71e989c72f95ad3396c8"
        },
        {
          "kind": "SCHEMA",
          "path": "reports/revision-v02.schema.json",
          "byte_length": 18074,
          "sha256": "36cede0a2d7fbcf67e80415d3a7e9713e25cb6734032feb72cbf88d0f95f4fdc"
        }
      ],
      "observed_summary": "reader_versions=[\"0.1\",\"0.2\"]",
      "blocker_codes": []
    },
    {
      "check_id": "INTAKE-06-005.GATE_EVIDENCE",
      "status": "MATCHED",
      "evidence_refs": [
        {
          "kind": "REPORT",
          "path": "reports/golden-contract.json",
          "byte_length": 1130,
          "sha256": "3a9fa11d5055bde6201d6e9cb54cbe97ad573c0b03581d5309d47b8d360d34b8"
        },
        {
          "kind": "REPORT",
          "path": "reports/golden-replay.json",
          "byte_length": 215314,
          "sha256": "3e3c9d9e6e444e30ed86fbca9cf10e2923f236e7acd84630bdd68ee9efe5b3da"
        },
        {
          "kind": "REPORT",
          "path": "reports/golden-coverage.json",
          "byte_length": 1567,
          "sha256": "bff75db7ef94ec2de7056fa5db410641e6605f52a466f8c771c5f8cbac504565"
        },
        {
          "kind": "REPORT",
          "path": "reports/trace-closure.json",
          "byte_length": 1199,
          "sha256": "6b9bf81346f2080d7de0ec2aa00d13f0a4849f0b0f355dc5575c3aebdbb57211"
        },
        {
          "kind": "REPORT",
          "path": "reports/golden-replay.json",
          "byte_length": 215314,
          "sha256": "3e3c9d9e6e444e30ed86fbca9cf10e2923f236e7acd84630bdd68ee9efe5b3da"
        },
        {
          "kind": "REPORT",
          "path": "reports/revision-compatibility.json",
          "byte_length": 16936,
          "sha256": "dbfd01966203ddb7b40b6b2e0552b41ef2fe2aae43dd3f7d69943e72e2758f08"
        }
      ],
      "observed_summary": "gate_count=6",
      "blocker_codes": []
    },
    {
      "check_id": "INTAKE-06-006.COVERAGE_COMPATIBILITY",
      "status": "MATCHED",
      "evidence_refs": [
        {
          "kind": "ASSET",
          "path": "reports/golden-coverage-catalog.json",
          "byte_length": 99105,
          "sha256": "dfde1f5b9ae003b8455712378b2a06439a0212682d79253739443e2734fe7466"
        },
        {
          "kind": "ASSET",
          "path": "reports/golden-manifest.json",
          "byte_length": 3766673,
          "sha256": "8aaca22c69402e08ff58a4a3e19eb38b260511dc7649c1deae8ac4fffce280a7"
        },
        {
          "kind": "ASSET",
          "path": "reports/active-grammar.json",
          "byte_length": 15930,
          "sha256": "c88e672bd9db7f0405a7ef3fc464043f15cae844931192e3412c94ce05339e7d"
        },
        {
          "kind": "REPORT",
          "path": "reports/golden-coverage.json",
          "byte_length": 1567,
          "sha256": "bff75db7ef94ec2de7056fa5db410641e6605f52a466f8c771c5f8cbac504565"
        },
        {
          "kind": "REPORT",
          "path": "reports/golden-replay.json",
          "byte_length": 215314,
          "sha256": "3e3c9d9e6e444e30ed86fbca9cf10e2923f236e7acd84630bdd68ee9efe5b3da"
        },
        {
          "kind": "REPORT",
          "path": "reports/revision-compatibility.json",
          "byte_length": 16936,
          "sha256": "dbfd01966203ddb7b40b6b2e0552b41ef2fe2aae43dd3f7d69943e72e2758f08"
        }
      ],
      "observed_summary": "semantic={\"expected\":178,\"pass\":130,\"blocked\":48}",
      "blocker_codes": []
    },
    {
      "check_id": "INTAKE-06-007.CAPABILITY_ELIGIBILITY",
      "status": "MATCHED",
      "evidence_refs": [
        {
          "kind": "HANDOFF",
          "path": "dev-canvas-05-handoff.json",
          "byte_length": 37088,
          "sha256": "aab281cf686d2b3c0e4ef1e9f62860d9318e3bed11c805e1dd53a40cd6f8e5a4"
        }
      ],
      "observed_summary": "capability_count=34",
      "blocker_codes": []
    },
    {
      "check_id": "INTAKE-06-008.PRODUCTION_GATE_DISABLED",
      "status": "MATCHED",
      "evidence_refs": [
        {
          "kind": "HANDOFF",
          "path": "dev-canvas-05-handoff.json",
          "byte_length": 37088,
          "sha256": "aab281cf686d2b3c0e4ef1e9f62860d9318e3bed11c805e1dd53a40cd6f8e5a4"
        }
      ],
      "observed_summary": "state=DISABLED",
      "blocker_codes": []
    }
  ],
  "capability_intake": [
    {
      "capability_id": "CAP-ISO-PROC-001",
      "family": "PROCEDURAL",
      "upstream_eligibility": "ELIGIBLE_FOR_RELEASE_VALIDATION",
      "coverage_keys": [
        "PROC:CAP-ISO-PROC-001:-:CONSUMPTION_OBJECT:PASS",
        "PROC:CAP-ISO-PROC-001:-:ENDPOINTS_REVERSED:BLOCKED"
      ],
      "template_refs": [
        "opl.consumption.v1"
      ],
      "rule_refs": [
        "rule.iso.proc.consumption.endpoints.v1"
      ],
      "symbol_refs": [
        "symbol.link.consumption"
      ],
      "grammar_refs": [
        {
          "id": "grammar.opl.iso19450.2024.draft",
          "version": "0.2.0",
          "sha256": "c88e672bd9db7f0405a7ef3fc464043f15cae844931192e3412c94ce05339e7d"
        }
      ],
      "binding_digest": "93805d6e2fdb3ea73c4ddfc0a995d662fbf13dee2d8a6f24fc20c79ecff65d1d",
      "upstream_evidence_fingerprint": "bdb9a4580e1349846d87a765254f96f2fb850e74a8bfd9829693b50b65a693f0",
      "intake_status": "MATCHED",
      "blocker_codes": []
    },
    {
      "capability_id": "CAP-ISO-PROC-002",
      "family": "PROCEDURAL",
      "upstream_eligibility": "ELIGIBLE_FOR_RELEASE_VALIDATION",
      "coverage_keys": [
        "PROC:CAP-ISO-PROC-002:-:RESULT_OBJECT:PASS",
        "PROC:CAP-ISO-PROC-002:-:ENDPOINTS_REVERSED:BLOCKED"
      ],
      "template_refs": [
        "opl.result.v1"
      ],
      "rule_refs": [
        "rule.iso.proc.result.endpoints.v1"
      ],
      "symbol_refs": [
        "symbol.link.result"
      ],
      "grammar_refs": [
        {
          "id": "grammar.opl.iso19450.2024.draft",
          "version": "0.2.0",
          "sha256": "c88e672bd9db7f0405a7ef3fc464043f15cae844931192e3412c94ce05339e7d"
        }
      ],
      "binding_digest": "93805d6e2fdb3ea73c4ddfc0a995d662fbf13dee2d8a6f24fc20c79ecff65d1d",
      "upstream_evidence_fingerprint": "1e3082143d966300e8cef99655a0d2545bc4306d17850f1b340c41495508f31f",
      "intake_status": "MATCHED",
      "blocker_codes": []
    },
    {
      "capability_id": "CAP-ISO-PROC-003",
      "family": "PROCEDURAL",
      "upstream_eligibility": "ELIGIBLE_FOR_RELEASE_VALIDATION",
      "coverage_keys": [
        "PROC:CAP-ISO-PROC-003:-:EFFECT_OBJECT:PASS",
        "PROC:CAP-ISO-PROC-003:-:ENDPOINTS_REVERSED:BLOCKED"
      ],
      "template_refs": [
        "opl.effect.v1"
      ],
      "rule_refs": [
        "rule.iso.proc.effect.endpoints.v1"
      ],
      "symbol_refs": [
        "symbol.link.effect"
      ],
      "grammar_refs": [
        {
          "id": "grammar.opl.iso19450.2024.draft",
          "version": "0.2.0",
          "sha256": "c88e672bd9db7f0405a7ef3fc464043f15cae844931192e3412c94ce05339e7d"
        }
      ],
      "binding_digest": "93805d6e2fdb3ea73c4ddfc0a995d662fbf13dee2d8a6f24fc20c79ecff65d1d",